{
  "model_key": "PAYNE:PA13NA",
  "circuit_type": "full",
  "components": [
    {
      "id": "PWR",
      "label": "208/230V 1Ø Power Supply",
      "kind": "terminal-block"
    },
    {
      "id": "CONT",
      "label": "Contactor",
      "kind": "contactor"
    },
    {
      "id": "COMP",
      "label": "Compressor",
      "kind": "compressor"
    },
    {
      "id": "CAP",
      "label": "Run Capacitor",
      "kind": "capacitor"
    },
    {
      "id": "OFM",
      "label": "Outdoor Fan Motor",
      "kind": "fan-motor"
    },
    {
      "id": "IDU",
      "kind": "terminal-block",
      "label": "24V (from indoor unit)"
    }
  ],
  "terminals": [
    {
      "component": "PWR",
      "id": "L1"
    },
    {
      "component": "PWR",
      "id": "L2"
    },
    {
      "component": "CONT",
      "id": "11"
    },
    {
      "component": "CONT",
      "id": "21"
    },
    {
      "component": "CONT",
      "id": "23L2"
    },
    {
      "component": "CONT",
      "id": "23T"
    },
    {
      "component": "CONT",
      "id": "A1"
    },
    {
      "component": "CONT",
      "id": "A2"
    },
    {
      "component": "COMP",
      "id": "C"
    },
    {
      "component": "COMP",
      "id": "S"
    },
    {
      "component": "COMP",
      "id": "R"
    },
    {
      "component": "CAP",
      "id": "H"
    },
    {
      "component": "CAP",
      "id": "C"
    },
    {
      "component": "CAP",
      "id": "F"
    },
    {
      "component": "OFM",
      "id": "L1"
    },
    {
      "component": "OFM",
      "id": "L2"
    },
    {
      "component": "IDU",
      "id": "R"
    },
    {
      "component": "IDU",
      "id": "C"
    }
  ],
  "nets": [
    {
      "id": "n1",
      "voltage_class": "line",
      "endpoints": [
        {
          "component": "PWR",
          "terminal": "L1"
        },
        {
          "component": "CONT",
          "terminal": "11"
        }
      ],
      "plain": "One leg of 240-volt power to the contactor.",
      "wire_color": "black"
    },
    {
      "id": "n2",
      "voltage_class": "line",
      "endpoints": [
        {
          "component": "PWR",
          "terminal": "L2"
        },
        {
          "component": "CONT",
          "terminal": "23L2"
        }
      ],
      "plain": "Second leg of 240-volt power to the contactor.",
      "wire_color": "black"
    },
    {
      "id": "n4",
      "voltage_class": "line",
      "endpoints": [
        {
          "component": "CONT",
          "terminal": "21"
        },
        {
          "component": "COMP",
          "terminal": "C"
        }
      ],
      "plain": "Contactor output to compressor common.",
      "wire_color": "black"
    },
    {
      "id": "n5",
      "voltage_class": "line",
      "endpoints": [
        {
          "component": "CONT",
          "terminal": "23T"
        },
        {
          "component": "CAP",
          "terminal": "C"
        }
      ],
      "plain": "Other line leg to run-capacitor common node.",
      "wire_color": "yellow"
    },
    {
      "id": "n6",
      "voltage_class": "start-winding",
      "endpoints": [
        {
          "component": "COMP",
          "terminal": "R"
        },
        {
          "component": "CAP",
          "terminal": "C"
        }
      ],
      "plain": "Compressor run terminal to capacitor common.",
      "wire_color": "yellow"
    },
    {
      "id": "n7",
      "voltage_class": "start-winding",
      "endpoints": [
        {
          "component": "COMP",
          "terminal": "S"
        },
        {
          "component": "CAP",
          "terminal": "H"
        }
      ],
      "plain": "Compressor start winding to run capacitor.",
      "wire_color": "blue"
    },
    {
      "id": "n12",
      "voltage_class": "line",
      "endpoints": [
        {
          "component": "CAP",
          "terminal": "F"
        },
        {
          "component": "OFM",
          "terminal": "L1"
        }
      ],
      "plain": "Run capacitor fan terminal to outdoor fan motor.",
      "wire_color": "brown"
    },
    {
      "id": "n13",
      "voltage_class": "line",
      "endpoints": [
        {
          "component": "OFM",
          "terminal": "L2"
        },
        {
          "component": "CAP",
          "terminal": "C"
        }
      ],
      "plain": "Outdoor fan motor return to capacitor common.",
      "wire_color": "yellow"
    },
    {
      "id": "n14",
      "voltage_class": "line",
      "endpoints": [
        {
          "component": "COMP",
          "terminal": "C"
        },
        {
          "component": "OFM",
          "terminal": "L2"
        }
      ],
      "plain": "Compressor common tied to fan motor line.",
      "wire_color": "black"
    },
    {
      "id": "ctl_call",
      "voltage_class": "low-voltage",
      "wire_color": "yellow",
      "label": "24V call to coil",
      "plain": "24-volt \"turn on\" signal from indoors to the contactor coil",
      "endpoints": [
        {
          "component": "IDU",
          "terminal": "R"
        },
        {
          "component": "CONT",
          "terminal": "COIL1"
        }
      ]
    },
    {
      "id": "ctl_com",
      "voltage_class": "low-voltage",
      "wire_color": "blue",
      "label": "24V common",
      "plain": "24-volt common back to the indoor unit",
      "endpoints": [
        {
          "component": "CONT",
          "terminal": "COIL2"
        },
        {
          "component": "IDU",
          "terminal": "C"
        }
      ]
    }
  ],
  "notes": [
    "The lower-right EXTERNAL POWER SUPPLY 24V block and the relay/coil next to *LLS are cropped/partially cut off at bottom of image; their internal wiring was not fully traced.",
    "Contactor coil terminal designations (A1/A2) not printed on diagram — inferred from coil symbol at bottom of contactor box (NOTE #14).",
    "*SR start relay terminals 1,2,5 traced but exact 5-terminal internal wiring is partly obscured (NOTE #8).",
    "BLK/BRN/VIO long jump wires along the mid-section were traced to their visible endpoints; some routing crosses behind components and could not be confirmed at every crossing.",
    "LLS BLK-to-BLK routing near bottom is partly cropped; endpoint into control string is best-effort.",
    "Apprentice CORE view — factory-optional safety/start parts left to the full manual."
  ],
  "schema_version": "1"
}