{
  "model_key": "CARRIER:24ACB4",
  "circuit_type": "full",
  "components": [
    {
      "id": "PWR",
      "label": "208/230V 1-Phase Power Supply",
      "kind": "terminal-block"
    },
    {
      "id": "CONT",
      "label": "Contactor",
      "kind": "contactor"
    },
    {
      "id": "COMP",
      "label": "Compressor",
      "kind": "compressor"
    },
    {
      "id": "CAP",
      "label": "Run Capacitor",
      "kind": "capacitor"
    },
    {
      "id": "OFM",
      "label": "Outdoor Fan Motor",
      "kind": "fan-motor"
    },
    {
      "id": "IDU",
      "kind": "terminal-block",
      "label": "24V (from indoor unit)"
    }
  ],
  "terminals": [
    {
      "component": "PWR",
      "id": "L1"
    },
    {
      "component": "PWR",
      "id": "L2"
    },
    {
      "component": "PWR",
      "id": "GND"
    },
    {
      "component": "CONT",
      "id": "11"
    },
    {
      "component": "CONT",
      "id": "21"
    },
    {
      "component": "CONT",
      "id": "23L"
    },
    {
      "component": "CONT",
      "id": "23R"
    },
    {
      "component": "CONT",
      "id": "A1"
    },
    {
      "component": "CONT",
      "id": "A2"
    },
    {
      "component": "COMP",
      "id": "C"
    },
    {
      "component": "COMP",
      "id": "S"
    },
    {
      "component": "COMP",
      "id": "R"
    },
    {
      "component": "CAP",
      "id": "H"
    },
    {
      "component": "CAP",
      "id": "C"
    },
    {
      "component": "CAP",
      "id": "F"
    },
    {
      "component": "OFM",
      "id": "BRN"
    },
    {
      "component": "OFM",
      "id": "BLK"
    },
    {
      "component": "OFM",
      "id": "YEL"
    },
    {
      "component": "OFM",
      "id": "GND"
    },
    {
      "component": "IDU",
      "id": "R"
    },
    {
      "component": "IDU",
      "id": "C"
    }
  ],
  "nets": [
    {
      "id": "n1",
      "voltage_class": "line",
      "wire_color": "red or black",
      "label": "L1",
      "plain": "One leg of the 240-volt power to the contactor line side.",
      "endpoints": [
        {
          "component": "PWR",
          "terminal": "L1"
        },
        {
          "component": "CONT",
          "terminal": "11"
        }
      ]
    },
    {
      "id": "n2",
      "voltage_class": "line",
      "wire_color": "black",
      "label": "L2",
      "plain": "Other leg of the 240-volt power to the contactor line side.",
      "endpoints": [
        {
          "component": "PWR",
          "terminal": "L2"
        },
        {
          "component": "CONT",
          "terminal": "23L"
        }
      ]
    },
    {
      "id": "n4",
      "voltage_class": "line",
      "wire_color": "black",
      "plain": "Load leg out of contactor feeds compressor run terminal.",
      "endpoints": [
        {
          "component": "CONT",
          "terminal": "21"
        },
        {
          "component": "COMP",
          "terminal": "R"
        }
      ]
    },
    {
      "id": "n8",
      "voltage_class": "line",
      "wire_color": "yellow",
      "plain": "Contactor load leg to compressor common terminal.",
      "endpoints": [
        {
          "component": "CONT",
          "terminal": "23R"
        },
        {
          "component": "COMP",
          "terminal": "C"
        }
      ]
    },
    {
      "id": "n9",
      "voltage_class": "line",
      "wire_color": "brown",
      "plain": "Contactor load leg powers the outdoor fan motor.",
      "endpoints": [
        {
          "component": "CONT",
          "terminal": "23R"
        },
        {
          "component": "OFM",
          "terminal": "BRN"
        }
      ]
    },
    {
      "id": "n10",
      "voltage_class": "start-winding",
      "wire_color": "yellow",
      "plain": "Run capacitor fan terminal to outdoor fan motor.",
      "endpoints": [
        {
          "component": "CAP",
          "terminal": "F"
        },
        {
          "component": "OFM",
          "terminal": "YEL"
        }
      ]
    },
    {
      "id": "n11",
      "voltage_class": "start-winding",
      "wire_color": "blue",
      "plain": "Run capacitor to compressor start winding terminal.",
      "endpoints": [
        {
          "component": "CAP",
          "terminal": "C"
        },
        {
          "component": "COMP",
          "terminal": "S"
        }
      ]
    },
    {
      "id": "n12",
      "voltage_class": "start-winding",
      "wire_color": "yellow",
      "plain": "Run capacitor herm terminal to compressor run winding.",
      "endpoints": [
        {
          "component": "CAP",
          "terminal": "H"
        },
        {
          "component": "COMP",
          "terminal": "R"
        }
      ]
    },
    {
      "id": "n13",
      "voltage_class": "line",
      "wire_color": "black",
      "plain": "Outdoor fan motor run lead ties into contactor load side.",
      "endpoints": [
        {
          "component": "OFM",
          "terminal": "BLK"
        },
        {
          "component": "CONT",
          "terminal": "23R"
        }
      ]
    },
    {
      "id": "ctl_call",
      "voltage_class": "low-voltage",
      "wire_color": "yellow",
      "label": "24V call to coil",
      "plain": "24-volt \"turn on\" signal from indoors to the contactor coil",
      "endpoints": [
        {
          "component": "IDU",
          "terminal": "R"
        },
        {
          "component": "CONT",
          "terminal": "COIL1"
        }
      ]
    },
    {
      "id": "ctl_com",
      "voltage_class": "low-voltage",
      "wire_color": "blue",
      "label": "24V common",
      "plain": "24-volt common back to the indoor unit",
      "endpoints": [
        {
          "component": "CONT",
          "terminal": "COIL2"
        },
        {
          "component": "IDU",
          "terminal": "C"
        }
      ]
    }
  ],
  "notes": [
    "High-pressure switch (*HPS) output wire (BLU/PNK) continues off the right edge of the crop — could not trace its far endpoint.",
    "Compressor time-delay *CTD terminal T1 output wire runs off-page to the right; endpoint not visible.",
    "Low-voltage thermostat terminals Y, G, R at right edge are cropped with dashed leads leaving the frame; downstream connections not traceable.",
    "Start relay *SR terminal 2 is drawn but its wire routing is not clearly legible in the crop.",
    "Exact tie point of contactor coil A1/A2 vs load poles (23) is partly obscured by overlapping lines near CONT; coil path inferred only from visibly-drawn wires and left conservative.",
    "Colors and labels near the top (*SC, *ST, CAP terminals H/C/F) are partially cut off at the top edge.",
    "Apprentice CORE view — factory-optional safety/start parts left to the full manual."
  ],
  "schema_version": "1"
}